{"$schema":"https://json-schema.org/draft/2020-12/schema","$id":"https://socioprophet.io/schemas/prophet-platform/devsecops-workroom/v0.1.0","title":"DevSecOpsWorkroomRecord","type":"object","additionalProperties":false,"required":["schema_version","workroom_id","lane","runtime_parity_level","behavioral_divergence_event","evidence_packets","rca_claims","action_grants","remediation_plans","regression_fixtures","issued_at","non_claims"],"properties":{"schema_version":{"type":"string","const":"0.1.0"},"workroom_id":{"type":"string","pattern":"^workroom:devsecops:"},"lane":{"type":"string","enum":["pre_merge_validation","post_merge_incident"]},"runtime_parity_level":{"type":"string","enum":["contract_only","synthetic_observed","runtime_observed"]},"validation_evidence_state":{"type":"string","enum":["not_configured","selected_only","missing_evidence","synthetic_observed","runtime_observed","verified_receipt","failed_receipt","stale_receipt"]},"source_refs":{"type":"object","additionalProperties":false,"properties":{"change_set_ref":{"type":"string"},"environment_request_ref":{"type":"string"},"validation_run_ref":{"type":"string"},"validation_receipt_ref":{"type":"string"},"validation_receipt_digest":{"type":"string"},"incident_ref":{"type":"string"},"investigation_run_ref":{"type":"string"},"topology_ref":{"type":"string"},"blast_radius_ref":{"type":"string"}}},"behavioral_divergence_event":{"type":"object","additionalProperties":false,"required":["event_id","event_type","source_lane","status","summary","evidence_refs","claim_refs","decision_state","non_claims"],"properties":{"event_id":{"type":"string","pattern":"^bde:"},"event_type":{"type":"string","enum":["pre_merge_validation_failure","pre_merge_validation_verified","sandbox_regression","contract_violation","performance_regression","security_policy_regression","production_incident","post_deploy_degradation","customer_impact_event"]},"source_lane":{"type":"string","enum":["pre_merge_validation","post_merge_incident"]},"status":{"type":"string","enum":["open","investigating","mitigated","resolved","converted_to_regression_fixture"]},"summary":{"type":"string","minLength":1},"environment_ref":{"type":"string"},"topology_ref":{"type":"string"},"evidence_refs":{"type":"array","items":{"type":"string","pattern":"^evidence://"}},"claim_refs":{"type":"array","items":{"type":"string","pattern":"^rca-claim:"}},"decision_state":{"type":"string","enum":["blocked","needs_review","allowed_read_only","resolved","candidate_only"]},"non_claims":{"type":"array","minItems":1,"items":{"type":"string"}}}},"evidence_packets":{"type":"array","minItems":1,"items":{"type":"object","additionalProperties":false,"required":["evidence_ref","evidence_type","producer","summary","observed_at","provenance","non_claims"],"properties":{"evidence_ref":{"type":"string","pattern":"^evidence://"},"evidence_type":{"type":"string","enum":["validation_result","runtime_receipt","log_observation","metric_observation","topology_snapshot","runbook_excerpt","deployment_metadata","manual_observation"]},"producer":{"type":"string"},"summary":{"type":"string","minLength":1},"observed_at":{"type":"string","format":"date-time"},"provenance":{"type":"object","additionalProperties":false,"required":["source_system","source_ref"],"properties":{"source_system":{"type":"string"},"source_ref":{"type":"string"},"collection_method":{"type":"string"}}},"non_claims":{"type":"array","minItems":1,"items":{"type":"string"}}}}},"rca_claims":{"type":"array","minItems":1,"items":{"type":"object","additionalProperties":false,"required":["claim_id","claim_status","statement","evidence_refs","counterevidence_refs","confidence","non_claims"],"properties":{"claim_id":{"type":"string","pattern":"^rca-claim:"},"claim_status":{"type":"string","enum":["observation","hypothesis","supported_causal_claim","confirmed_causal_claim","falsified_claim","unknown"]},"statement":{"type":"string","minLength":1},"evidence_refs":{"type":"array","items":{"type":"string","pattern":"^evidence://"}},"counterevidence_refs":{"type":"array","items":{"type":"string","pattern":"^evidence://"}},"confidence":{"type":"string","enum":["none","low","medium","high"]},"non_claims":{"type":"array","minItems":1,"items":{"type":"string"}}}}},"action_grants":{"type":"array","items":{"type":"object","additionalProperties":false,"required":["grant_id","action_class","status","scope","approval_required","non_claims"],"properties":{"grant_id":{"type":"string","pattern":"^action-grant:"},"action_class":{"type":"string","enum":["read_only","diagnostic_mutation","reversible_mitigation","irreversible_mutation","credential_sensitive","data_sensitive","customer_visible","destructive","privileged_identity","network_exposure","production_change"]},"status":{"type":"string","enum":["allowed","blocked","requires_human_approval","not_requested"]},"scope":{"type":"string"},"approval_required":{"type":"boolean"},"non_claims":{"type":"array","minItems":1,"items":{"type":"string"}}}}},"remediation_plans":{"type":"array","items":{"type":"object","additionalProperties":false,"required":["plan_id","plan_status","risk_class","summary","evidence_refs","required_action_grant_refs","non_claims"],"properties":{"plan_id":{"type":"string","pattern":"^remediation-plan:"},"plan_status":{"type":"string","enum":["candidate","blocked","approved","executed","rejected"]},"risk_class":{"type":"string","enum":["read_only","low","medium","high","critical"]},"summary":{"type":"string","minLength":1},"evidence_refs":{"type":"array","items":{"type":"string","pattern":"^evidence://"}},"required_action_grant_refs":{"type":"array","items":{"type":"string","pattern":"^action-grant:"}},"non_claims":{"type":"array","minItems":1,"items":{"type":"string"}}}}},"regression_fixtures":{"type":"array","items":{"type":"object","additionalProperties":false,"required":["fixture_id","fixture_status","derived_from","summary","target_validation_plan_ref","non_claims"],"properties":{"fixture_id":{"type":"string","pattern":"^regression-fixture:"},"fixture_status":{"type":"string","enum":["candidate","accepted","rejected"]},"derived_from":{"type":"string"},"summary":{"type":"string","minLength":1},"target_validation_plan_ref":{"type":"string"},"non_claims":{"type":"array","minItems":1,"items":{"type":"string"}}}}},"issued_at":{"type":"string","format":"date-time"},"non_claims":{"type":"array","minItems":1,"items":{"type":"string"}}}}