{
  "schema_version": "0.1.0",
  "workroom_id": "workroom:devsecops:pre-merge:sociosphere-svf-verified",
  "lane": "pre_merge_validation",
  "runtime_parity_level": "runtime_observed",
  "validation_evidence_state": "verified_receipt",
  "source_refs": {
    "change_set_ref": "changeset://github/SocioProphet/sociosphere/pull/434",
    "environment_request_ref": "environment:validate-change-v2-request:sociosphere-svf",
    "validation_run_ref": "svf:run:sociosphere.registry-dogfood.verified",
    "validation_receipt_ref": "svf:receipt:sociosphere.registry-dogfood.verified",
    "validation_receipt_digest": "sha256:aaaaaaaaaaaaaaaaaaaaaaaaaaaaaaaaaaaaaaaaaaaaaaaaaaaaaaaaaaaaaaaa",
    "topology_ref": "topology://sociosphere/svf/local-dogfood"
  },
  "behavioral_divergence_event": {
    "event_id": "bde:pre-merge-validation-success:sociosphere-svf",
    "event_type": "pre_merge_validation_failure",
    "source_lane": "pre_merge_validation",
    "status": "resolved",
    "summary": "Fixture models a verified SVF local receipt for Sociosphere registry dogfood validation.",
    "environment_ref": "environment://local/sociosphere/svf",
    "topology_ref": "topology://sociosphere/svf/local-dogfood",
    "evidence_refs": [
      "evidence://sociosphere/svf/registry-dogfood/verified-receipt"
    ],
    "claim_refs": [
      "rca-claim:sociosphere-svf:receipt-observed"
    ],
    "decision_state": "resolved",
    "non_claims": [
      "Resolved state is fixture-scoped.",
      "Fixture does not certify production readiness."
    ]
  },
  "evidence_packets": [
    {
      "evidence_ref": "evidence://sociosphere/svf/registry-dogfood/verified-receipt",
      "evidence_type": "runtime_receipt",
      "producer": "Sociosphere SVF local runner",
      "summary": "Verified local SVF receipt for registered Action execution and receipt digest verification.",
      "observed_at": "2026-05-31T18:46:09Z",
      "provenance": {
        "source_system": "Sociosphere",
        "source_ref": "svf:receipt:sociosphere.registry-dogfood.verified",
        "collection_method": "fixture_mirrors_svf_local_receipt"
      },
      "non_claims": [
        "Receipt is local-only.",
        "Receipt does not certify container, browser, QEMU, cluster, or Signadot vendor parity."
      ]
    }
  ],
  "rca_claims": [
    {
      "claim_id": "rca-claim:sociosphere-svf:receipt-observed",
      "claim_status": "observation",
      "statement": "A Sociosphere SVF local receipt can be represented as runtime-observed validation evidence when the receipt reference is present and evidence provenance points to it.",
      "evidence_refs": [
        "evidence://sociosphere/svf/registry-dogfood/verified-receipt"
      ],
      "counterevidence_refs": [],
      "confidence": "high",
      "non_claims": [
        "Observation is about fixture representation.",
        "Observation does not authorize remediation."
      ]
    }
  ],
  "action_grants": [
    {
      "grant_id": "action-grant:sociosphere-svf:read-receipt",
      "action_class": "read_only",
      "status": "allowed",
      "scope": "Read SVF receipt references and validation evidence for PR readiness.",
      "approval_required": false,
      "non_claims": [
        "Grant permits read-only receipt inspection only.",
        "Grant does not authorize execution."
      ]
    }
  ],
  "remediation_plans": [
    {
      "plan_id": "remediation-plan:sociosphere-svf:none-required",
      "plan_status": "approved",
      "risk_class": "read_only",
      "summary": "No code remediation is required for the verified receipt fixture.",
      "evidence_refs": [
        "evidence://sociosphere/svf/registry-dogfood/verified-receipt"
      ],
      "required_action_grant_refs": [
        "action-grant:sociosphere-svf:read-receipt"
      ],
      "non_claims": [
        "Approval is fixture-scoped.",
        "No production mutation is authorized."
      ]
    }
  ],
  "regression_fixtures": [
    {
      "fixture_id": "regression-fixture:sociosphere-svf:receipt-gate",
      "fixture_status": "candidate",
      "derived_from": "bde:pre-merge-validation-success:sociosphere-svf",
      "summary": "Preserve a Workroom fixture that permits runtime_observed only with verified SVF receipt evidence.",
      "target_validation_plan_ref": "svf:plan:sociosphere.registry-dogfood",
      "non_claims": [
        "Fixture is not a live execution record.",
        "Fixture does not replace Sociosphere receipt verification."
      ]
    }
  ],
  "issued_at": "2026-05-31T18:47:00Z",
  "non_claims": [
    "This fixture models receipt consumption only.",
    "This fixture does not execute SVF Actions.",
    "This fixture does not create or sign receipts."
  ]
}
